### ISSUE TITLE
[FEATURE] Support load balancers on non-management interfaces for guest clusters

### ISSUE THREAD

**Issue by starbops** [yasker/vm#5486]
**Is your feature request related to a problem? Please describe.**

If a guest Kubernetes cluster consists of multi-network-attached VMs, all the load balancer IP addresses allocated for the LB type of Services can still only be assigned to the VMs' management interface.

One intention of an additional network is to separate the workload traffic from management traffic in terms of cluster stability and security. Sometimes, we want to leverage the load balancer feature to expose such a workload. However, with the current implementation, the load balancer IP addresses can only attached to the management network. Hence, the traffic still tangles together.

The reason behind is that the `kube-vip` chart deployed is configured with no `vip_interface` specified, so the Pods end up working on the management interfaces.

**Describe the solution you'd like**

We might need the operator logic for `kube-vip` being implemented in `harvester-cloud-provider`, to dynamically decide what network interface `kube-vip` should work on.

**Describe alternatives you've considered**

Manually update the `vip_interface` environment variable for the `kube-vip` DaemonSet can also do the trick.

**Additional context**

With the underlying network infra configured appropriately, the workload endpoint can still be reached despite the LB IP address allocated from the `IP pool-B` associated to `network-B` is attached to the management interface (attached to `network-A`).

For example, creating a RKE2 guest cluster with three nodes using the Rancher Integration feature. Each node will be attached to two discrete networks:

- `net-100`: VLAN100, 192.168.100.0/24
- `net-101`: VLAN101, 192.168.101.0/24

<img width="1532" alt="image" src="https://github.com/harvester/harvester/assets/1827717/db1134a0-3b77-4b55-9a57-c894a0cefd85">

Create an IP pool for `net-101`, called `pool-101`. It should be look like the following:

```shell
$ kubectl get ippools.loadbalancer pool-101 -o yaml
apiVersion: loadbalancer.harvesterhci.io/v1beta1
kind: IPPool
metadata:
  creationTimestamp: "2024-03-27T06:01:44Z"
  finalizers:
  - wrangler.cattle.io/harvester-ipam-controller
  generation: 43
  labels:
    loadbalancer.harvesterhci.io/global-ip-pool: "true"
    loadbalancer.harvesterhci.io/vid: "101"
  name: pool-101
  resourceVersion: "366450180"
  uid: 6804dce7-7ea2-4ce3-9840-0b44c500a8f2
spec:
  ranges:
  - gateway: 192.168.101.1
    rangeEnd: 192.168.101.60
    rangeStart: 192.168.101.51
    subnet: 192.168.101.0/24
  selector:
    network: default/net-101
    scope:
    - guestCluster: '*'
      namespace: '*'
      project: '*'
```

On the guest cluster, create an Nginx deployment and its associated LB type of Service. Wait for `harvester-cloud-provider` to create a LoadBalancer CR (reconcile by `harvester-load-balancer`) on the Harvester cluster and `kube-vip` configure the allocated LB IP address on the node's network interface.

Find out the `kube-vip` leader Pod on the guest cluster (you can achieve that by checking the log of each `kube-vip` Pod). Locate what node the leader Pod runs on, and shell into the node.

Check the LB IP address, it should be assigned to the network interface attached to `net-100`:

```shell
$ ip a show enp1s0
2: enp1s0: <BROADCAST,MULTICAST,UP,LOWER_UP> mtu 1500 qdisc fq_codel state UP group default qlen 1000
    link/ether 22:d7:e7:65:49:38 brd ff:ff:ff:ff:ff:ff
    inet 192.168.100.103/24 brd 192.168.100.255 scope global dynamic enp1s0
       valid_lft 31534229sec preferred_lft 31534229sec
    inet 192.168.101.57/32 scope global enp1s0
       valid_lft forever preferred_lft forever
    inet6 fe80::20d7:e7ff:fe65:4938/64 scope link 
       valid_lft forever preferred_lft forever

$ ip a show enp2s0
3: enp2s0: <BROADCAST,MULTICAST,UP,LOWER_UP> mtu 1500 qdisc fq_codel state UP group default qlen 1000
    link/ether 52:33:46:ca:6a:e5 brd ff:ff:ff:ff:ff:ff
    inet 192.168.101.111/24 brd 192.168.101.255 scope global dynamic enp2s0
       valid_lft 31534227sec preferred_lft 31534227sec
    inet6 fe80::5033:46ff:feca:6ae5/64 scope link 
       valid_lft forever preferred_lft forever
```

Try to access the workload somewhere outside the guest cluster:

```shell
curl 192.168.101.57
```

By monitoring the two interfaces on the node, we can see that the traffic route is apparently asymmetric: ingress on `enp2s0` and egress on `enp1s0`.

```shell
$ sudo tcpdump -p -ennvi enp1s0 port 80
tcpdump: listening on enp1s0, link-type EN10MB (Ethernet), capture size 262144 bytes
10:43:23.518148 22:d7:e7:65:49:38 > e4:8d:8c:61:8d:f7, ethertype IPv4 (0x0800), length 74: (tos 0x0, ttl 62, id 0, offset 0, flags [DF], proto TCP (6), length 60)
    192.168.101.57.80 > 192.168.88.180.49612: Flags [S.], cksum 0xfc8f (correct), seq 3843625858, ack 1622278472, win 64308, options [mss 1410,sackOK,TS val 4111268799 ecr 1831966317,nop,wscale 7], length 0
10:43:23.519006 22:d7:e7:65:49:38 > e4:8d:8c:61:8d:f7, ethertype IPv4 (0x0800), length 66: (tos 0x0, ttl 62, id 48304, offset 0, flags [DF], proto TCP (6), length 52)
    192.168.101.57.80 > 192.168.88.180.49612: Flags [.], cksum 0x2419 (correct), ack 79, win 502, options [nop,nop,TS val 4111268800 ecr 1831966318], length 0
10:43:23.519473 22:d7:e7:65:49:38 > e4:8d:8c:61:8d:f7, ethertype IPv4 (0x0800), length 304: (tos 0x0, ttl 62, id 48305, offset 0, flags [DF], proto TCP (6), length 290)
    192.168.101.57.80 > 192.168.88.180.49612: Flags [P.], cksum 0xa970 (correct), seq 1:239, ack 79, win 502, options [nop,nop,TS val 4111268800 ecr 1831966318], length 238: HTTP, length: 238
	HTTP/1.1 200 OK
	Server: nginx/1.25.4
	Date: Thu, 28 Mar 2024 10:43:23 GMT
	Content-Type: text/html
	Content-Length: 615
	Last-Modified: Wed, 14 Feb 2024 16:03:00 GMT
	Connection: keep-alive
	ETag: "65cce434-267"
	Accept-Ranges: bytes
	
10:43:23.519548 22:d7:e7:65:49:38 > e4:8d:8c:61:8d:f7, ethertype IPv4 (0x0800), length 681: (tos 0x0, ttl 62, id 48306, offset 0, flags [DF], proto TCP (6), length 667)
    192.168.101.57.80 > 192.168.88.180.49612: Flags [P.], cksum 0x8c37 (correct), seq 239:854, ack 79, win 502, options [nop,nop,TS val 4111268800 ecr 1831966318], length 615: HTTP
10:43:23.520191 22:d7:e7:65:49:38 > e4:8d:8c:61:8d:f7, ethertype IPv4 (0x0800), length 66: (tos 0x0, ttl 62, id 48307, offset 0, flags [DF], proto TCP (6), length 52)
    192.168.101.57.80 > 192.168.88.180.49612: Flags [F.], cksum 0x20c0 (correct), seq 854, ack 80, win 502, options [nop,nop,TS val 4111268801 ecr 1831966319], length 0
```

```shell
$ sudo tcpdump -p -ennvi enp2s0 port 80
tcpdump: listening on enp2s0, link-type EN10MB (Ethernet), capture size 262144 bytes
10:43:29.647762 e4:8d:8c:61:8d:f7 > 52:33:46:ca:6a:e5, ethertype IPv4 (0x0800), length 74: (tos 0x0, ttl 62, id 45721, offset 0, flags [DF], proto TCP (6), length 60)
    192.168.88.180.40094 > 192.168.101.57.80: Flags [S], cksum 0x7ea1 (correct), seq 2270711639, win 64240, options [mss 1460,sackOK,TS val 1831972447 ecr 0,nop,wscale 7], length 0
10:43:29.648288 e4:8d:8c:61:8d:f7 > 52:33:46:ca:6a:e5, ethertype IPv4 (0x0800), length 66: (tos 0x0, ttl 62, id 45722, offset 0, flags [DF], proto TCP (6), length 52)
    192.168.88.180.40094 > 192.168.101.57.80: Flags [.], cksum 0xc332 (correct), ack 1740673690, win 502, options [nop,nop,TS val 1831972448 ecr 3880649083], length 0
10:43:29.648418 e4:8d:8c:61:8d:f7 > 52:33:46:ca:6a:e5, ethertype IPv4 (0x0800), length 144: (tos 0x0, ttl 62, id 45723, offset 0, flags [DF], proto TCP (6), length 130)
    192.168.88.180.40094 > 192.168.101.57.80: Flags [P.], cksum 0x4574 (correct), seq 0:78, ack 1, win 502, options [nop,nop,TS val 1831972448 ecr 3880649083], length 78: HTTP, length: 78
	GET / HTTP/1.1
	Host: 192.168.101.57
	User-Agent: curl/7.58.0
	Accept: */*
	
10:43:29.649327 e4:8d:8c:61:8d:f7 > 52:33:46:ca:6a:e5, ethertype IPv4 (0x0800), length 66: (tos 0x0, ttl 62, id 45724, offset 0, flags [DF], proto TCP (6), length 52)
    192.168.88.180.40094 > 192.168.101.57.80: Flags [.], cksum 0xc1f5 (correct), ack 239, win 501, options [nop,nop,TS val 1831972449 ecr 3880649084], length 0
10:43:29.649429 e4:8d:8c:61:8d:f7 > 52:33:46:ca:6a:e5, ethertype IPv4 (0x0800), length 66: (tos 0x0, ttl 62, id 45725, offset 0, flags [DF], proto TCP (6), length 52)
    192.168.88.180.40094 > 192.168.101.57.80: Flags [.], cksum 0xbf8e (correct), ack 854, win 501, options [nop,nop,TS val 1831972449 ecr 3880649084], length 0
10:43:29.649554 e4:8d:8c:61:8d:f7 > 52:33:46:ca:6a:e5, ethertype IPv4 (0x0800), length 66: (tos 0x0, ttl 62, id 45726, offset 0, flags [DF], proto TCP (6), length 52)
    192.168.88.180.40094 > 192.168.101.57.80: Flags [F.], cksum 0xbf8d (correct), seq 78, ack 854, win 501, options [nop,nop,TS val 1831972449 ecr 3880649084], length 0
10:43:29.650000 e4:8d:8c:61:8d:f7 > 52:33:46:ca:6a:e5, ethertype IPv4 (0x0800), length 66: (tos 0x0, ttl 62, id 45727, offset 0, flags [DF], proto TCP (6), length 52)
    192.168.88.180.40094 > 192.168.101.57.80: Flags [.], cksum 0xbf8c (correct), ack 855, win 501, options [nop,nop,TS val 1831972449 ecr 3880649084], length 0
```

Ideally, such kind of traffic should all go through the second interface (which attaches to the `net-101` network).

**Comment by innobead** [comment]
cc @mingshuoqiu

**Comment by dhaugli** [comment]
I can confirm this LB type would be very needed, for any situation a VM needs a LB where one dosen't have something like BigIP or for a situation you try to deploy a different kubernetes type other than Rancher on Harvester that is not out of the box compatible with Harvester Cloud Provider.

**Comment by belgaied2** [comment]
@starbops Can we generalize this feature to the VM Load Balancer feature of Harvester and not only Load Balancer in guest Kubernetes clusters?

==> [FEATURE] Support load balancers on non-management interfaces ~~for guest Kubernetes clusters~~

**Comment by starbops** [comment]
@belgaied2 Thanks for the heads-up. I was about to create a separate issue specifically for the VM-type load balancers, as their usage and implementation are quite different. Let me know if you have other suggestions.

**Comment by belgaied2** [comment]
@starbops Sounds good to me!

**Comment by Yu-Jack** [comment]
I found out that we can use the annotation of `kube-vip.io/serviceInterface: auto` in svc  to automatically bind the IP address to the correct network interface. It can reduce a lot of work.

Good case:

<img width="2582" height="1202" alt="Image" src="https://github.com/user-attachments/assets/3d6a60ab-09ef-4737-890e-919607bc78dd" />

Wrong case:

<img width="2564" height="1160" alt="Image" src="https://github.com/user-attachments/assets/5da46bf6-19db-403d-8a32-e36f1f97e686" />

Source codes:
- [kube-vip/pkg/instance/instance.go at 00da316fe894876283614fd8650d7c1067c8cf0f · kube-vip/kube-vip](https://github.com/kube-vip/kube-vip/blob/00da316fe894876283614fd8650d7c1067c8cf0f/pkg/instance/instance.go#L79-L105) - https://github.com/kube-vip/kube-vip/blob/00da316fe894876283614fd8650d7c1067c8cf0f/pkg/instance/instance.go#L79-L105
- [kube-vip/pkg/instance/instance.go at 00da316fe894876283614fd8650d7c1067c8cf0f · kube-vip/kube-vip](https://github.com/kube-vip/kube-vip/blob/00da316fe894876283614fd8650d7c1067c8cf0f/pkg/instance/instance.go#L378-L405) - https://github.com/kube-vip/kube-vip/blob/00da316fe894876283614fd8650d7c1067c8cf0f/pkg/instance/instance.go#L378-L405

Demo:

https://github.com/user-attachments/assets/be2ec688-5f14-40a5-92e0-b9f3afa3a0ea

https://github.com/user-attachments/assets/66fdcddd-0fc3-48c6-bde5-178d9db39063

**Comment by Yu-Jack** [comment]
This is the difference between binding to different network interfaces in the strict mode `arp.ignore=1` (Thanks @starbops for mentioning this). And, what we want is to be able to make the request through the same subnet and correct network interface.

https://github.com/user-attachments/assets/446f1395-0ce8-41c5-9ca8-407b545d4ba9

https://github.com/user-attachments/assets/5c7a57e0-8049-40b3-9d33-e96573f6ba92

**Comment by w13915984028** [comment]
There are some additional limitations to notice:

(1) At the moment, kube-vip works togethere with k8s service, it exposes the VIP on ARP mode by default, and nat traffic to service endpointslices (to mgmt network of the guest cluster)

(2) If kube-vip plans to work purely on the second-network of guest cluster,it/some other controller needs to build an endpointslices similiar object to store the second network IPs of the related PODs/VMs, and play the NAT rules to let traffic goes from the VIP to second network subnet IPs directly

(3)When set kube-vip for LB type service to work on non-default interfaces, if (2) is not soved, then there are followings challenges: 
A. The Asymmetric Routing Conflict (Reverse Path Filtering)
B. The "Hairpin" and NAT Conflict 

This is the similar topic for Harvester side VM type LB working on second network.

(4) For LB service to set it's working network, on PR https://github.com/harvester/cloud-provider-harvester/pull/74, there is a global flag "--loadbalancer-network", but it seems still not enough, maybe we need to add another flag like `--allow-loadbalancer-specify-network` and pass this to remote, if getting IP from IPPool.  The cloud-provider-harvester also needs to read the related annotations/labels from the k8s service object and map/amend to kube-vip flags.

**Comment by Yu-Jack** [comment]
> There are some additional limitations to notice:
> 
> (1) At the moment, kube-vip works togethere with k8s service, it exposes the VIP on ARP mode by default, and nat traffic to service endpointslices (to mgmt network of the guest cluster)
> 
> (2) If kube-vip plans to work purely on the second-network of guest cluster,it/some other controller needs to build an endpointslices similiar object to store the second network IPs of the related PODs/VMs, and play the NAT rules to let traffic goes from the VIP to second network subnet IPs directly
> 
> (3)When set kube-vip for LB type service to work on non-default interfaces, if (2) is not soved, then there are followings challenges: A. The Asymmetric Routing Conflict (Reverse Path Filtering) B. The "Hairpin" and NAT Conflict
> 
> This is the similar topic for Harvester side VM type LB working on second network.
> 
> (4) For LB service to set it's working network, on PR [harvester/cloud-provider-harvester#74](https://github.com/harvester/cloud-provider-harvester/pull/74), there is a global flag "--loadbalancer-network", but it seems still not enough, maybe we need to add another flag like `--allow-loadbalancer-specify-network` and pass this to remote, if getting IP from IPPool. The cloud-provider-harvester also needs to read the related annotations/labels from the k8s service object and map/amend to kube-vip flags.

Hi @w13915984028 , I just discussed with @starbops. We'd like this issue to focus on binding issue instead of asymmetric routing traffic. So, I opened another issue to track asymmetric routing traffic issue, please check  https://github.com/harvester/harvester/issues/10586 and continue the discussion there.

**Comment by Yu-Jack** [comment]
Hi @w13915984028, I'm going to release new HCP version, do you have other PRs which you want to merge?

**Comment by innobead** [comment]
Discussed with @Vicente-Cheng , this issue should not wait to be verified until the UI issue is ready. We should always provide a headless path for each feature, even when it has a corresponding UI integration. Verifying the headless process is good enough to close this feature and deliver it to users with a notice. 

For UI issues that depend on the Rancher UI integration and can't keep up with the Rancher release or the UI team's limited bandwidth, they can be moved to the next minor release with a reason. 

cc @harvester/tpm  @harvester/pm  @khushboo-rancher

**Comment by Vicente-Cheng** [comment]
According to the above discussion, moved to `Ready for Testing`. @Yu-Jack could you add the corresponding test plan if we don't have UI. Like the headless path for this feature. 

Thanks!

**Comment by asc5543** [comment]
## Test result
Test PASS

## Environment
* Harvester ISO version: `v1.9.0-rc4`
* Rancher ISO version: `v2.15.0`
* Harvester UI Extension version: `v1.9.0-rc4`
* Underlying Infrastructure (e.g. Baremetal with Dell PowerEdge R630): `1 node Baremetal`


## Test Scenario
### Preparation
1. <details> <summary> Install Harvester with 2 network </summary>

    <img width="1915" height="995" alt="Image" src="https://github.com/user-attachments/assets/b9481c5e-cf48-40cc-8ed6-5062ed0c033d" />
    <img width="1915" height="995" alt="Image" src="https://github.com/user-attachments/assets/d9fbcd5b-8e90-4bb7-a9f0-fdbf921265b0" />

   </details>

1. <details> <summary> Install Rancher and Harvester-ui-extension </summary>

    <img width="1915" height="995" alt="Image" src="https://github.com/user-attachments/assets/ec3679a3-d724-4add-b220-3dd0d4fc2c40" />

   </details>

1. <details> <summary> Import harvester to Rancher </summary>

    <img width="1915" height="995" alt="Image" src="https://github.com/user-attachments/assets/f615f39b-f075-4919-8246-54887268f315" />

   </details>


### Test Steps
1. <details>
   <summary> ✔ Modify the rke-metadata-config to dev-v2.15 to ensure rke2 has HCP 0.2.14
   </summary>

    <img width="1915" height="995" alt="Image" src="https://github.com/user-attachments/assets/31a1af3f-5be5-493a-a732-2e4bd801651c" />
    
   </details>

1. <details>
   <summary> ✔ Provision a guest cluster. This cluster should have two network at least.
   </summary>

    <img width="1915" height="995" alt="Image" src="https://github.com/user-attachments/assets/ffc065ef-6f83-425d-aa69-4bd7bbd0596c" />

   </details>

1. <details>
   <summary> ✔ Create a deployment nginx:latest in the guest cluster.
   </summary>
  
    <img width="1915" height="995" alt="Image" src="https://github.com/user-attachments/assets/1721dff3-4d29-4c70-ae3b-3b9e3c367f57" />

   </details>

1. <details>
   <summary> ✔ Find the config map called kube-system/harvester-nad-mapping in the guest cluster.
   </summary>
  
    ```
    > kubectl --kubeconfig gc.yaml get cm harvester-nad-mapping -n kube-system -o yaml
    apiVersion: v1
    data:
      interface-nad-mapping: '{"default/cn-2017":"enp2s0","default/mgmt-2011":"enp1s0"}'
    kind: ConfigMap
    metadata:
      creationTimestamp: "2026-08-11T06:48:33Z"
      name: harvester-nad-mapping
      namespace: kube-system
      resourceVersion: "1609"
      uid: b63e25b6-0df8-4af9-aecd-d1afee452c88
    ```
    
   </details>

1. <details>
   <summary> ✔ Activate all second network cards with the command on all ndoes
   </summary>
  
    ```
    cat <<EOF > /etc/netplan/99-enp2s0.yaml
    network:
      version: 2
      ethernets:
        enp2s0:
          dhcp4: true
    EOF
    sudo netplan apply
    ```
    
   </details>

1. <details>
   <summary> ✔ Create ippool
   </summary>
  
    <img width="1915" height="995" alt="Image" src="https://github.com/user-attachments/assets/3b06c203-6fb2-4d32-acbf-17c3dc0a2140" />
    <img width="1915" height="995" alt="Image" src="https://github.com/user-attachments/assets/009a9304-0431-4847-a39c-22f5a85f0ce0" />

    <img width="1921" height="1002" alt="Image" src="https://github.com/user-attachments/assets/62e4ffbc-2446-48ca-83a8-153bd62fba8d" />
    <img width="1921" height="1002" alt="Image" src="https://github.com/user-attachments/assets/c93cd528-32aa-4c5c-8a79-3332aaa74ec3" />

   </details>

1. <details>
   <summary> ✔ Create a load balancer type service with the following combination annotations
   </summary>

    Combination 1

    ```
    `cloudprovider.harvesterhci.io/ipam: "dhcp"`
    `cloudprovider.harvesterhci.io/network: "default/cn-2017"`
    ```
    
    <img width="1915" height="995" alt="Image" src="https://github.com/user-attachments/assets/5ee9b043-e1f1-419b-95ef-5483d8642d94" />
    <img width="1915" height="995" alt="Image" src="https://github.com/user-attachments/assets/01fbeda6-652d-47e5-9b1e-e12787d4130d" />

    Combination 2

    ```
    `cloudprovider.harvesterhci.io/ipam: "dhcp"`
    `cloudprovider.harvesterhci.io/network: "default/mgmt-2011"`
    ```

    <img width="1915" height="995" alt="Image" src="https://github.com/user-attachments/assets/914dffac-1637-4097-9d08-fe4cc05f220e" />
    <img width="1915" height="995" alt="Image" src="https://github.com/user-attachments/assets/6c905b8f-35a6-433b-b079-7e686059f83d" />

    Combination 3
    
    ```
    `cloudprovider.harvesterhci.io/ipam: "pool"`
    `cloudprovider.harvesterhci.io/network: "default/cn-2017"`
    ```
    
    <img width="1921" height="1002" alt="Image" src="https://github.com/user-attachments/assets/27155f2c-c206-42c0-89ec-58343c60cbb1" />
    <img width="1915" height="995" alt="Image" src="https://github.com/user-attachments/assets/aae57f7b-366c-4448-b5b9-dd3441ac04c5" />
    <img width="1921" height="1002" alt="Image" src="https://github.com/user-attachments/assets/8e744da5-e472-433e-a2d0-857b7aa214ec" />

    Combination 4
    
    ```
    `cloudprovider.harvesterhci.io/ipam: "pool"`
    `cloudprovider.harvesterhci.io/network: "default/mgmt-2011"`
    ```
    
    <img width="1921" height="1002" alt="Image" src="https://github.com/user-attachments/assets/e54a5607-5403-4019-bbf5-947fac50fc95" />
    <img width="1921" height="1002" alt="Image" src="https://github.com/user-attachments/assets/8592db50-41bc-4b7a-a10d-80194a69ab49" />
    <img width="1921" height="1002" alt="Image" src="https://github.com/user-attachments/assets/d7e7f6f1-1157-4881-92e9-49cbc50753a1" />


   </details>

1. <details>
   <summary> ✔ Use ip a to check whether ip is bound into correct network interface.
   </summary>

    Combination 1

    ```
    > kubectl get service combination1 -n default -o yaml
    apiVersion: v1
    kind: Service
    metadata:
      annotations:
        cloudprovider.harvesterhci.io/ipam: dhcp
        cloudprovider.harvesterhci.io/network: default/cn-2017
        field.cattle.io/publicEndpoints: '[{"addresses":["10.115.55.30"],"port":80,"protocol":"TCP","serviceName":"default:combination1","allNodes":false}]'
        kube-vip.io/hwaddr: 00:00:6c:21:fd:44
        kube-vip.io/loadbalancerIPs: 0.0.0.0
        kube-vip.io/requestedIP: 10.115.55.30
        kube-vip.io/serviceInterface: enp2s0
        kube-vip.io/vipHost: gc2-pool1-rg5mx-tw5lc
    ```
    
    ```
    26: vip-bf62dd55@enp2s0: <BROADCAST,MULTICAST,UP,LOWER_UP> mtu 1500 qdisc noqueue state UP group default 
        link/ether 00:00:6c:21:fd:44 brd ff:ff:ff:ff:ff:ff
        inet 10.115.55.30/32 scope global deprecated vip-bf62dd55
           valid_lft forever preferred_lft forever
        inet6 fe80::200:6cff:fe21:fd44/64 scope link 
           valid_lft forever preferred_lft forever
    ```

    Combination 2

    ```
    > kubectl get service combination2 -n default -o yaml
    apiVersion: v1
    kind: Service
    metadata:
      annotations:
        cloudprovider.harvesterhci.io/ipam: dhcp
        cloudprovider.harvesterhci.io/network: default/mgmt-2011
        field.cattle.io/publicEndpoints: '[{"addresses":["10.115.1.197"],"port":80,"protocol":"TCP","serviceName":"default:combination2","allNodes":false}]'
        kube-vip.io/hwaddr: 00:00:6c:2a:b2:ae
        kube-vip.io/loadbalancerIPs: 0.0.0.0
        kube-vip.io/requestedIP: 10.115.1.197
        kube-vip.io/serviceInterface: enp1s0
        kube-vip.io/vipHost: gc2-pool1-rg5mx-tw5lc
    ```
    
    ```
    28: vip-483300a9@enp1s0: <BROADCAST,MULTICAST,UP,LOWER_UP> mtu 1500 qdisc noqueue state UP group default 
        link/ether 00:00:6c:2a:b2:ae brd ff:ff:ff:ff:ff:ff
        inet 10.115.1.197/32 scope global deprecated vip-483300a9
           valid_lft forever preferred_lft forever
        inet6 fe80::200:6cff:fe2a:b2ae/64 scope link 
           valid_lft forever preferred_lft forever
    ```


    Combination 3

    ```
    > kubectl get service combination3 -n default -o yaml
    apiVersion: v1
    kind: Service
    metadata:
      annotations:
        cloudprovider.harvesterhci.io/ipam: pool
        cloudprovider.harvesterhci.io/network: default/cn-2017
        field.cattle.io/publicEndpoints: '[{"addresses":["10.115.51.10"],"port":80,"protocol":"TCP","serviceName":"default:combination3","allNodes":false}]'
        kube-vip.io/loadbalancerIPs: 10.115.51.10
        kube-vip.io/serviceInterface: enp2s0
        kube-vip.io/vipHost: gc2-pool1-rg5mx-tw5lc
    ```
    
    ```
    3: enp2s0: <BROADCAST,MULTICAST,UP,LOWER_UP> mtu 1500 qdisc fq_codel state UP group default qlen 1000
        link/ether b6:02:f6:57:76:9d brd ff:ff:ff:ff:ff:ff
        inet 10.115.51.62/21 metric 100 brd 10.115.55.255 scope global dynamic enp2s0
           valid_lft 599sec preferred_lft 599sec
        inet 10.115.51.10/32 scope global deprecated enp2s0
           valid_lft forever preferred_lft forever
        inet6 fe80::b402:f6ff:fe57:769d/64 scope link 
           valid_lft forever preferred_lft forever
    ```


    Combination 4
    
    ```
    > kubectl get service combination4 -n default -o yaml
    apiVersion: v1
    kind: Service
    metadata:
      annotations:
        cloudprovider.harvesterhci.io/ipam: pool
        cloudprovider.harvesterhci.io/network: default/mgmt-2011
        field.cattle.io/publicEndpoints: '[{"addresses":["10.115.7.100"],"port":80,"protocol":"TCP","serviceName":"default:combination4","allNodes":false}]'
        kube-vip.io/loadbalancerIPs: 10.115.7.100
        kube-vip.io/serviceInterface: enp1s0
        kube-vip.io/vipHost: gc2-pool1-rg5mx-tw5lc
    ```
    
    ```
    2: enp1s0: <BROADCAST,MULTICAST,UP,LOWER_UP> mtu 1500 qdisc fq_codel state UP group default qlen 1000
        link/ether 5a:4e:3e:03:40:6c brd ff:ff:ff:ff:ff:ff
        inet 10.115.2.178/21 metric 100 brd 10.115.7.255 scope global dynamic enp1s0
           valid_lft 598sec preferred_lft 598sec
        inet 10.115.7.100/32 scope global deprecated enp1s0
           valid_lft forever preferred_lft forever
        inet6 fe80::584e:3eff:fe03:406c/64 scope link 
           valid_lft forever preferred_lft forever
    ```


   </details>

**Comment by asc5543** [comment]
Verified the function side, close this ticket.
